<?xml version="1.0" encoding="UTF-8" standalone="no"?>
<!DOCTYPE ALGORITHM SYSTEM "http://sierra2.stanford.edu/sierra/ASI2.2.dtd">
<ALGORITHM>
  <ALGNAME>KPL</ALGNAME>
  <ALGVERSION>1.1</ALGVERSION>
  <ALGDATE>2019-08-16</ALGDATE>
  <DEFINITIONS>
    <GENE_DEFINITION>
      <NAME>PR</NAME>
      <DRUGCLASSLIST>PI</DRUGCLASSLIST>
    </GENE_DEFINITION>
    
    <LEVEL_DEFINITION>
      <ORDER>1</ORDER>
      <ORIGINAL>Susceptible</ORIGINAL>
      <SIR>S</SIR>
    </LEVEL_DEFINITION>
    <LEVEL_DEFINITION>
      <ORDER>2</ORDER>
      <ORIGINAL>Potential Low-Level Resistance</ORIGINAL>
      <SIR>S</SIR>
    </LEVEL_DEFINITION>
    <LEVEL_DEFINITION>
      <ORDER>3</ORDER>
      <ORIGINAL>Low-Level Resistance</ORIGINAL>
      <SIR>I</SIR>
    </LEVEL_DEFINITION>
    <LEVEL_DEFINITION>
      <ORDER>4</ORDER>
      <ORIGINAL>Intermediate Resistance</ORIGINAL>
      <SIR>I</SIR>
    </LEVEL_DEFINITION>
    <LEVEL_DEFINITION>
      <ORDER>5</ORDER>
      <ORIGINAL>High-Level Resistance</ORIGINAL>
      <SIR>R</SIR>
    </LEVEL_DEFINITION>
    
    <DRUGCLASS>
      <NAME>PI</NAME>
      <DRUGLIST>ATV/r</DRUGLIST>
    </DRUGCLASS>
    
    <GLOBALRANGE><![CDATA[(-INF TO 9 => 1,  10 TO 14 => 2,  15 TO 29 => 3,  30 TO 59 => 4,  60 TO INF => 5)]]></GLOBALRANGE>
    
    <COMMENT_DEFINITIONS>
      
      <COMMENT_STRING id="GTE2">
      	<TEXT><![CDATA[Level is greater than or equal to 2]]></TEXT>
		<SORT_TAG>1</SORT_TAG>
      </COMMENT_STRING>
	  <COMMENT_STRING id="GTE3">
      	<TEXT><![CDATA[Level is greater than or equal to 3]]></TEXT>
		<SORT_TAG>1</SORT_TAG>
      </COMMENT_STRING>
	  <COMMENT_STRING id="GTE4">
      	<TEXT><![CDATA[Level is greater than or equal to 4]]></TEXT>
		<SORT_TAG>1</SORT_TAG>
      </COMMENT_STRING>
	  
	  <COMMENT_STRING id="GT2">
      	<TEXT><![CDATA[Level is greater than 2]]></TEXT>
		<SORT_TAG>1</SORT_TAG>
      </COMMENT_STRING>
	  <COMMENT_STRING id="GT3">
      	<TEXT><![CDATA[Level is greater than 3]]></TEXT>
		<SORT_TAG>1</SORT_TAG>
      </COMMENT_STRING>
	  <COMMENT_STRING id="GT4">
      	<TEXT><![CDATA[Level is greater than 4]]></TEXT>
		<SORT_TAG>1</SORT_TAG>
      </COMMENT_STRING>
	  
	  <COMMENT_STRING id="LTE2">
      	<TEXT><![CDATA[Level is less than or equal to 2]]></TEXT>
		<SORT_TAG>1</SORT_TAG>
      </COMMENT_STRING>
	  <COMMENT_STRING id="LTE3">
      	<TEXT><![CDATA[Level is less than or equal to 3]]></TEXT>
		<SORT_TAG>1</SORT_TAG>
      </COMMENT_STRING>
	  <COMMENT_STRING id="LTE4">
      	<TEXT><![CDATA[Level is less than or equal to 4]]></TEXT>
		<SORT_TAG>1</SORT_TAG>
      </COMMENT_STRING>
	  
	  <COMMENT_STRING id="LT2">
      	<TEXT><![CDATA[Level is less than 2]]></TEXT>
		<SORT_TAG>1</SORT_TAG>
      </COMMENT_STRING>
	  <COMMENT_STRING id="LT3">
      	<TEXT><![CDATA[Level is less than 3]]></TEXT>
		<SORT_TAG>1</SORT_TAG>
      </COMMENT_STRING>
	  <COMMENT_STRING id="LT4">
      	<TEXT><![CDATA[Level is less than 4]]></TEXT>
		<SORT_TAG>1</SORT_TAG>
      </COMMENT_STRING>
	  
	  <COMMENT_STRING id="EQ2">
      	<TEXT><![CDATA[Level is equal to 2]]></TEXT>
		<SORT_TAG>1</SORT_TAG>
      </COMMENT_STRING>
	  <COMMENT_STRING id="EQ3">
      	<TEXT><![CDATA[Level is equal to 3]]></TEXT>
		<SORT_TAG>1</SORT_TAG>
      </COMMENT_STRING>
	  <COMMENT_STRING id="EQ4">
      	<TEXT><![CDATA[Level is equal to 4]]></TEXT>
		<SORT_TAG>1</SORT_TAG>
      </COMMENT_STRING>
	  
	  <COMMENT_STRING id="NEQ2">
      	<TEXT><![CDATA[Level is not equal to 2]]></TEXT>
		<SORT_TAG>1</SORT_TAG>
      </COMMENT_STRING>
	  <COMMENT_STRING id="NEQ3">
      	<TEXT><![CDATA[Level is not equal to 3]]></TEXT>
		<SORT_TAG>1</SORT_TAG>
      </COMMENT_STRING>
	  <COMMENT_STRING id="NEQ4">
      	<TEXT><![CDATA[Level is not equal to 4]]></TEXT>
		<SORT_TAG>1</SORT_TAG>
      </COMMENT_STRING>
    </COMMENT_DEFINITIONS>
    
  </DEFINITIONS>
  
 
	<DRUG>
        <NAME>ATV/r</NAME>
        <FULLNAME>atazanavir/r</FULLNAME>
        <RULE>
            <CONDITION>
                SCORE FROM (20T => 25)
            </CONDITION>
            <ACTIONS>
                <SCORERANGE><USE_GLOBALRANGE/></SCORERANGE>
            </ACTIONS>
        </RULE>
    </DRUG>

  <RESULT_COMMENTS>
  
  <!--KPL Note 16-Aug-2019: The DRUG_LEVEL_CONDITIONS examples here are messy because I had to reformat this document
  after the ASI 1.4.0 to 1.5.0 syntax change. Check the KPL_1.1.xml doc for a cleaner example of how to format this section -->
		
		<!--GTE-->
		<RESULT_COMMENT_RULE>
			<DRUG_LEVEL_CONDITIONS><DRUG_LEVEL_CONDITION>
				<DRUG_NAME>ATV/r</DRUG_NAME>
				<GTE>2</GTE>
			</DRUG_LEVEL_CONDITION></DRUG_LEVEL_CONDITIONS>
			<LEVEL_ACTION>
				<COMMENT ref="GTE2"/>
			</LEVEL_ACTION>
		</RESULT_COMMENT_RULE>
		<RESULT_COMMENT_RULE>
			<DRUG_LEVEL_CONDITIONS><DRUG_LEVEL_CONDITION>
				<DRUG_NAME>ATV/r</DRUG_NAME>
				<GTE>3</GTE>
			</DRUG_LEVEL_CONDITION></DRUG_LEVEL_CONDITIONS>
			<LEVEL_ACTION>
				<COMMENT ref="GTE3"/>
			</LEVEL_ACTION>
		</RESULT_COMMENT_RULE>
		<RESULT_COMMENT_RULE>
			<DRUG_LEVEL_CONDITIONS><DRUG_LEVEL_CONDITION>
				<DRUG_NAME>ATV/r</DRUG_NAME>
				<GTE>4</GTE>
			</DRUG_LEVEL_CONDITION></DRUG_LEVEL_CONDITIONS>
			<LEVEL_ACTION>
				<COMMENT ref="GTE4"/>
			</LEVEL_ACTION>
		</RESULT_COMMENT_RULE>
		
		<!--GT-->
		<RESULT_COMMENT_RULE>
			<DRUG_LEVEL_CONDITIONS><DRUG_LEVEL_CONDITION>
				<DRUG_NAME>ATV/r</DRUG_NAME>
				<GT>2</GT>
			</DRUG_LEVEL_CONDITION></DRUG_LEVEL_CONDITIONS>
			<LEVEL_ACTION>
				<COMMENT ref="GT2"/>
			</LEVEL_ACTION>
		</RESULT_COMMENT_RULE>
		<RESULT_COMMENT_RULE>
			<DRUG_LEVEL_CONDITIONS><DRUG_LEVEL_CONDITION>
				<DRUG_NAME>ATV/r</DRUG_NAME>
				<GT>3</GT>
			</DRUG_LEVEL_CONDITION></DRUG_LEVEL_CONDITIONS>
			<LEVEL_ACTION>
				<COMMENT ref="GT3"/>
			</LEVEL_ACTION>
		</RESULT_COMMENT_RULE>
		<RESULT_COMMENT_RULE>
			<DRUG_LEVEL_CONDITIONS><DRUG_LEVEL_CONDITION>
				<DRUG_NAME>ATV/r</DRUG_NAME>
				<GT>4</GT>
			</DRUG_LEVEL_CONDITION></DRUG_LEVEL_CONDITIONS>
			<LEVEL_ACTION>
				<COMMENT ref="GT4"/>
			</LEVEL_ACTION>
		</RESULT_COMMENT_RULE>
		
		<!--LTE-->
		<RESULT_COMMENT_RULE>
			<DRUG_LEVEL_CONDITIONS><DRUG_LEVEL_CONDITION>
				<DRUG_NAME>ATV/r</DRUG_NAME>
				<LTE>2</LTE>
			</DRUG_LEVEL_CONDITION></DRUG_LEVEL_CONDITIONS>
			<LEVEL_ACTION>
				<COMMENT ref="LTE2"/>
			</LEVEL_ACTION>
		</RESULT_COMMENT_RULE>
		<RESULT_COMMENT_RULE>
			<DRUG_LEVEL_CONDITIONS><DRUG_LEVEL_CONDITION>
				<DRUG_NAME>ATV/r</DRUG_NAME>
				<LTE>3</LTE>
			</DRUG_LEVEL_CONDITION></DRUG_LEVEL_CONDITIONS>
			<LEVEL_ACTION>
				<COMMENT ref="LTE3"/>
			</LEVEL_ACTION>
		</RESULT_COMMENT_RULE>
		<RESULT_COMMENT_RULE>
			<DRUG_LEVEL_CONDITIONS><DRUG_LEVEL_CONDITION>
				<DRUG_NAME>ATV/r</DRUG_NAME>
				<LTE>4</LTE>
			</DRUG_LEVEL_CONDITION></DRUG_LEVEL_CONDITIONS>
			<LEVEL_ACTION>
				<COMMENT ref="LTE4"/>
			</LEVEL_ACTION>
		</RESULT_COMMENT_RULE>
		
		<!--LT-->
		<RESULT_COMMENT_RULE>
			<DRUG_LEVEL_CONDITIONS><DRUG_LEVEL_CONDITION>
				<DRUG_NAME>ATV/r</DRUG_NAME>
				<LT>2</LT>
			</DRUG_LEVEL_CONDITION></DRUG_LEVEL_CONDITIONS>
			<LEVEL_ACTION>
				<COMMENT ref="LT2"/>
			</LEVEL_ACTION>
		</RESULT_COMMENT_RULE>
		<RESULT_COMMENT_RULE>
			<DRUG_LEVEL_CONDITIONS><DRUG_LEVEL_CONDITION>
				<DRUG_NAME>ATV/r</DRUG_NAME>
				<LT>3</LT>
			</DRUG_LEVEL_CONDITION></DRUG_LEVEL_CONDITIONS>
			<LEVEL_ACTION>
				<COMMENT ref="LT3"/>
			</LEVEL_ACTION>
		</RESULT_COMMENT_RULE>
		<RESULT_COMMENT_RULE>
			<DRUG_LEVEL_CONDITIONS><DRUG_LEVEL_CONDITION>
				<DRUG_NAME>ATV/r</DRUG_NAME>
				<LT>4</LT>
			</DRUG_LEVEL_CONDITION></DRUG_LEVEL_CONDITIONS>
			<LEVEL_ACTION>
				<COMMENT ref="LT4"/>
			</LEVEL_ACTION>
		</RESULT_COMMENT_RULE>
		
		<!--EQ-->
		<RESULT_COMMENT_RULE>
			<DRUG_LEVEL_CONDITIONS><DRUG_LEVEL_CONDITION>
				<DRUG_NAME>ATV/r</DRUG_NAME>
				<EQ>2</EQ>
			</DRUG_LEVEL_CONDITION></DRUG_LEVEL_CONDITIONS>
			<LEVEL_ACTION>
				<COMMENT ref="EQ2"/>
			</LEVEL_ACTION>
		</RESULT_COMMENT_RULE>
		<RESULT_COMMENT_RULE>
			<DRUG_LEVEL_CONDITIONS><DRUG_LEVEL_CONDITION>
				<DRUG_NAME>ATV/r</DRUG_NAME>
				<EQ>3</EQ>
			</DRUG_LEVEL_CONDITION></DRUG_LEVEL_CONDITIONS>
			<LEVEL_ACTION>
				<COMMENT ref="EQ3"/>
			</LEVEL_ACTION>
		</RESULT_COMMENT_RULE>
		<RESULT_COMMENT_RULE>
			<DRUG_LEVEL_CONDITIONS><DRUG_LEVEL_CONDITION>
				<DRUG_NAME>ATV/r</DRUG_NAME>
				<EQ>4</EQ>
			</DRUG_LEVEL_CONDITION></DRUG_LEVEL_CONDITIONS>
			<LEVEL_ACTION>
				<COMMENT ref="EQ4"/>
			</LEVEL_ACTION>
		</RESULT_COMMENT_RULE>
		
		<!--NEQ-->
		<RESULT_COMMENT_RULE>
			<DRUG_LEVEL_CONDITIONS><DRUG_LEVEL_CONDITION>
				<DRUG_NAME>ATV/r</DRUG_NAME>
				<NEQ>2</NEQ>
			</DRUG_LEVEL_CONDITION></DRUG_LEVEL_CONDITIONS>
			<LEVEL_ACTION>
				<COMMENT ref="NEQ2"/>
			</LEVEL_ACTION>
		</RESULT_COMMENT_RULE>
		<RESULT_COMMENT_RULE>
			<DRUG_LEVEL_CONDITIONS><DRUG_LEVEL_CONDITION>
				<DRUG_NAME>ATV/r</DRUG_NAME>
				<NEQ>3</NEQ>
			</DRUG_LEVEL_CONDITION></DRUG_LEVEL_CONDITIONS>
			<LEVEL_ACTION>
				<COMMENT ref="NEQ3"/>
			</LEVEL_ACTION>
		</RESULT_COMMENT_RULE>
		<RESULT_COMMENT_RULE>
			<DRUG_LEVEL_CONDITIONS><DRUG_LEVEL_CONDITION>
				<DRUG_NAME>ATV/r</DRUG_NAME>
				<NEQ>4</NEQ>
			</DRUG_LEVEL_CONDITION></DRUG_LEVEL_CONDITIONS>
			<LEVEL_ACTION>
				<COMMENT ref="NEQ4"/>
			</LEVEL_ACTION>
		</RESULT_COMMENT_RULE>
  </RESULT_COMMENTS>
</ALGORITHM>
